{
  "schema_version": 1,
  "metadata": {
    "exported_at": 1787363076.0110373,
    "total_nodes": 13,
    "total_edges": 68
  },
  "nodes": {
    "5656956b639d4b86363dbe7563ed543452686a5038b08d7f3293c9db5741e6eb": {
      "node_id": "5656956b639d4b86363dbe7563ed543452686a5038b08d7f3293c9db5741e6eb",
      "anchor": "BOOT",
      "occurrence": 1,
      "persistent_state_root": null,
      "volatile_state_root": null,
      "rng_state": null,
      "config_id": "reference-1024-windowed",
      "retail_build_sha256": "",
      "tags": [
        "scene:_firstcust"
      ],
      "description": "Initial state for _firstcust-skip-probe",
      "metadata": {}
    },
    "aa6a3d1f7e774e5b722cd23a43ef5b6fafbf0cc844dac252716be3a35902774e": {
      "node_id": "aa6a3d1f7e774e5b722cd23a43ef5b6fafbf0cc844dac252716be3a35902774e",
      "anchor": "DOWN_READY",
      "occurrence": 1,
      "persistent_state_root": null,
      "volatile_state_root": null,
      "rng_state": null,
      "config_id": "reference-1024-windowed",
      "retail_build_sha256": "",
      "tags": [
        "scene:down_ready"
      ],
      "description": "Destination state reached by title-down-press",
      "metadata": {}
    },
    "d4af2a13ad6a1f099d9bab1fb4e955c5eb910ba5a915291a220519cf6756bc79": {
      "node_id": "d4af2a13ad6a1f099d9bab1fb4e955c5eb910ba5a915291a220519cf6756bc79",
      "anchor": "ENCYCLOPEDIA_READY",
      "occurrence": 1,
      "persistent_state_root": null,
      "volatile_state_root": null,
      "rng_state": null,
      "config_id": "reference-1024-windowed",
      "retail_build_sha256": "",
      "tags": [
        "scene:encyclopedia_ready"
      ],
      "description": "Destination state reached by title-encyclopedia",
      "metadata": {}
    },
    "8229b38cc136af7da782c8a3013f88d2afb9103730654b5e51accf3e9abd78a2": {
      "node_id": "8229b38cc136af7da782c8a3013f88d2afb9103730654b5e51accf3e9abd78a2",
      "anchor": "HOUSE_FREEROAM",
      "occurrence": 1,
      "persistent_state_root": null,
      "volatile_state_root": null,
      "rng_state": null,
      "config_id": "reference-1024-windowed",
      "retail_build_sha256": "",
      "tags": [
        "scene:house"
      ],
      "description": "Initial state for house-customer-skip-tutorial",
      "metadata": {}
    },
    "d718e7945bea19582a488db6eb059ae09a9ca2ef97d42ce31d3111b504c40f9f": {
      "node_id": "d718e7945bea19582a488db6eb059ae09a9ca2ef97d42ce31d3111b504c40f9f",
      "anchor": "LOAD_READY",
      "occurrence": 1,
      "persistent_state_root": null,
      "volatile_state_root": null,
      "rng_state": null,
      "config_id": "reference-1024-windowed",
      "retail_build_sha256": "",
      "tags": [
        "scene:load_ready"
      ],
      "description": "Destination state reached by title-load-confirm",
      "metadata": {}
    },
    "6baa4ee1b8291db7184ea3c9ef27385acd0e6345a30de841204fb4a5e9a58cb9": {
      "node_id": "6baa4ee1b8291db7184ea3c9ef27385acd0e6345a30de841204fb4a5e9a58cb9",
      "anchor": "OPTIONS_READY",
      "occurrence": 1,
      "persistent_state_root": null,
      "volatile_state_root": null,
      "rng_state": null,
      "config_id": "reference-1024-windowed",
      "retail_build_sha256": "",
      "tags": [
        "scene:options_ready"
      ],
      "description": "Destination state reached by title-options",
      "metadata": {}
    },
    "f6a0629c590f65c336f73c78cf1dc7177901e121ce38eede94b12fc6106ad925": {
      "node_id": "f6a0629c590f65c336f73c78cf1dc7177901e121ce38eede94b12fc6106ad925",
      "anchor": "PAUSE_OPEN",
      "occurrence": 1,
      "persistent_state_root": null,
      "volatile_state_root": null,
      "rng_state": null,
      "config_id": "reference-1024-windowed",
      "retail_build_sha256": "",
      "tags": [
        "scene:pause_open"
      ],
      "description": "Destination state reached by house-pause-encyclopedia",
      "metadata": {}
    },
    "ef298df35acca19ab4b19b9566d00510da121fade0f6af59ca5ac3556b593557": {
      "node_id": "ef298df35acca19ab4b19b9566d00510da121fade0f6af59ca5ac3556b593557",
      "anchor": "PICKER_READY",
      "occurrence": 1,
      "persistent_state_root": null,
      "volatile_state_root": null,
      "rng_state": null,
      "config_id": "reference-1024-windowed",
      "retail_build_sha256": "",
      "tags": [
        "scene:picker_ready"
      ],
      "description": "Destination state reached by title-picker-cancel",
      "metadata": {}
    },
    "69840486981e50b0468a969101266cf04ba74bce197bd2df28765edf96b807ff": {
      "node_id": "69840486981e50b0468a969101266cf04ba74bce197bd2df28765edf96b807ff",
      "anchor": "RECORDS_READY",
      "occurrence": 1,
      "persistent_state_root": null,
      "volatile_state_root": null,
      "rng_state": null,
      "config_id": "reference-1024-windowed",
      "retail_build_sha256": "",
      "tags": [
        "scene:records_ready"
      ],
      "description": "Destination state reached by title-records",
      "metadata": {}
    },
    "0b61a6b940877397cdb1c373f4de646cfabbdbb4e1eaaff5276cd22c055d74f1": {
      "node_id": "0b61a6b940877397cdb1c373f4de646cfabbdbb4e1eaaff5276cd22c055d74f1",
      "anchor": "SAVE_PICKER_READY",
      "occurrence": 1,
      "persistent_state_root": null,
      "volatile_state_root": null,
      "rng_state": null,
      "config_id": "reference-1024-windowed",
      "retail_build_sha256": "",
      "tags": [
        "scene:save_picker_ready"
      ],
      "description": "Destination state reached by house-pause-save-commit",
      "metadata": {}
    },
    "3511a2aa2f28bb042c2e4044dd65c08108ae51e882143b4049144e46b774a81f": {
      "node_id": "3511a2aa2f28bb042c2e4044dd65c08108ae51e882143b4049144e46b774a81f",
      "anchor": "SURVIVAL_READY",
      "occurrence": 1,
      "persistent_state_root": null,
      "volatile_state_root": null,
      "rng_state": null,
      "config_id": "reference-1024-windowed",
      "retail_build_sha256": "",
      "tags": [
        "scene:survival_ready"
      ],
      "description": "Destination state reached by title-survival",
      "metadata": {}
    },
    "420125726eb93ab5a4b3bdf14d6ebb578be14f1486ed4c0b275d4799250772e5": {
      "node_id": "420125726eb93ab5a4b3bdf14d6ebb578be14f1486ed4c0b275d4799250772e5",
      "anchor": "TITLE_MENU",
      "occurrence": 1,
      "persistent_state_root": null,
      "volatile_state_root": null,
      "rng_state": null,
      "config_id": "reference-1024-windowed",
      "retail_build_sha256": "",
      "tags": [
        "scene:title"
      ],
      "description": "Initial state for title-down-press",
      "metadata": {}
    },
    "19eb0b706d95ea8d3ccc07902b0430a53ae94d47506e57e5cc2a15691610c7bd": {
      "node_id": "19eb0b706d95ea8d3ccc07902b0430a53ae94d47506e57e5cc2a15691610c7bd",
      "anchor": "Z_READY",
      "occurrence": 1,
      "persistent_state_root": null,
      "volatile_state_root": null,
      "rng_state": null,
      "config_id": "reference-1024-windowed",
      "retail_build_sha256": "",
      "tags": [
        "scene:z_ready"
      ],
      "description": "Destination state reached by title-z-press",
      "metadata": {}
    }
  },
  "edges": {
    "23d4eeaa043c1a3e740906689bbe9c1719a58ad6e226823c438eec0cf6ee26e0": {
      "edge_id": "23d4eeaa043c1a3e740906689bbe9c1719a58ad6e226823c438eec0cf6ee26e0",
      "src_node_id": "5656956b639d4b86363dbe7563ed543452686a5038b08d7f3293c9db5741e6eb",
      "dst_node_id": "5656956b639d4b86363dbe7563ed543452686a5038b08d7f3293c9db5741e6eb",
      "label": "_firstcust-skip-probe",
      "input_digest": "7c1a6062ec72fe0be62840fe2f92b77c35d0cb603bffd63f6cc973fadb92eda5",
      "duration_frames": 40000,
      "completion_condition": {
        "kind": "frame_count",
        "count": 40000
      },
      "normalization_policy": {},
      "action_tags": [
        "_firstcust-skip-probe"
      ],
      "scenario_ref": "_firstcust-skip-probe",
      "proof_id": null,
      "coverage_delta": {
        "functions": [],
        "blocks": [],
        "transitions": [],
        "opcodes": []
      },
      "status": "port_verified",
      "metadata": {
        "description": "PROBE (retail b150 lifecycle): load \u2192 tutorial \u2192 ESC-skip \u2192 first customer,\ntruncated after the first BARGAIN round. For RE of the cc08==4 skip\u2192first-\ncustomer b150 modal-hold (rec f461\u2192f1018). NOT a parity scenario.\n"
      }
    },
    "eda5da2036d38cd0aa9c1f0cca0abe617ee7297e5738e9c5699ff7cadd20d3c7": {
      "edge_id": "eda5da2036d38cd0aa9c1f0cca0abe617ee7297e5738e9c5699ff7cadd20d3c7",
      "src_node_id": "5656956b639d4b86363dbe7563ed543452686a5038b08d7f3293c9db5741e6eb",
      "dst_node_id": "5656956b639d4b86363dbe7563ed543452686a5038b08d7f3293c9db5741e6eb",
      "label": "_probe-dayend-memsnap",
      "input_digest": "363cde56684c98e35eb58d0b62c1d63787def99bc383d29fa7454e3cf5008cc3",
      "duration_frames": 90000,
      "completion_condition": {
        "kind": "frame_count",
        "count": 90000
      },
      "normalization_policy": {},
      "action_tags": [
        "_probe-dayend-memsnap"
      ],
      "scenario_ref": "_probe-dayend-memsnap",
      "proof_id": null,
      "coverage_delta": {
        "functions": [],
        "blocks": [],
        "transitions": [],
        "opcodes": []
      },
      "status": "port_verified",
      "metadata": {
        "description": "Full post-tutorial story-cutscene flow \u2192 day 2.  Recorded skip path:\nload \u2192 tutorial \u2192 ESC-skip \u2192 first customer \u2192 cutscenes \u2192 day 2 brooming.\n"
      }
    },
    "056718799990a4f9bd35123f5a4b20da5c159ccac2620618140472c69653b290": {
      "edge_id": "056718799990a4f9bd35123f5a4b20da5c159ccac2620618140472c69653b290",
      "src_node_id": "5656956b639d4b86363dbe7563ed543452686a5038b08d7f3293c9db5741e6eb",
      "dst_node_id": "5656956b639d4b86363dbe7563ed543452686a5038b08d7f3293c9db5741e6eb",
      "label": "_probe-dayend-rngcs",